id,title,url,date,feed,type,description,image,_url,site_name,image:width,image:height,locale,latitude,longitude,streetaddress,city,state,image:type,updated_time,image:url,email
128,"Facebook prefers to work ""at scale."" Wouldn't we all?",https://mailchi.mp/71d34b7d317d/facebook-prefers-to-work-at-scale,2018-03-28T13:01:52,instapaper,,,,https://mailchi.mp/71d34b7d317d/facebook-prefers-to-work-at-scale,,,,,,,,,,,,,
108,Being a Two-Career Couple Requires a Long-Term Plan,https://hbr.org/2018/02/being-a-two-career-couple-requires-a-long-term-plan,2018-02-27T14:24:41,instapaper,article,The questions you should be asking.,https://hbr.org/resources/images/hbr_opengraph_940x490.png,https://hbr.org/2018/02/being-a-two-career-couple-requires-a-long-term-plan,Harvard Business Review,,,,,,,,,,,,
117,How Maps Look Different When Women Make Them ,https://www.citylab.com/equity/2018/03/who-maps-the-world/555272/,2018-03-15T01:58:00,instapaper,article,"For one thing, childcare centers and women's health clinics show up as readily as sports arenas. ",https://cdn.citylab.com/media/img/citylab/2018/03/RTR1QXNF/facebook.jpg?1520972624,https://www.citylab.com/equity/2018/03/who-maps-the-world/555272/,CityLab,,,en_US,,,,,,,,,
112,Membership as a force multiplier for beat reporting - PressThink,http://pressthink.org/2018/03/membership-as-a-force-multiplier-beat-reporting-paper/,2018-03-09T21:47:31,newsblur,article,"Just published a ""concept paper"" for an idea I have been trying to introduce for 11 years. It may take 11 more but I don't care. I think it's a good idea.",http://pressthink.org/wp-content/themes/wp-pressthink/assets/images/pressthink-card-485-253.jpg,http://pressthink.org/2018/03/membership-as-a-force-multiplier-beat-reporting-paper/,PressThink,485,253,en_US,,,,,,,2018-03-12T10:30:33-04:00,,
122,"""I Was Just Flabbergasted."" Discovering Cambridge Analytica.",https://www.pbs.org/wgbh/frontline/article/i-was-just-flabbergasted-discovering-cambridge-analytica/,2018-03-21T21:47:40,newsblur,article,"One evening during the 2016 presidential primaries, Sam Woolley wandered into a meet-up on digital political messaging in the basement of a New York City tech store. At the gathering, he says, a group of experts boasted of an uncanny ability to influence voters on social media. The name of their company: Cambridge Analytica.",https://i1.wp.com/www.pbs.org/wgbh/frontline/wp-content/uploads/2018/03/GettyImages-935866960.jpg?resize=1200%2C630,https://www.pbs.org/wgbh/frontline/article/i-was-just-flabbergasted-discovering-cambridge-analytica/,FRONTLINE,1200,630,,,,,,,,,,
113,Making the Count,https://flowingdata.com/2018/03/05/making-the-count/,2018-03-09T13:50:34,newsblur,article,"As 2020 approaches, let’s aim for higher accuracy and less uncertainty.",https://i2.wp.com/flowingdata.com/wp-content/uploads/2018/03/people.gif?fit=1200%2C687&ssl=1,http://flowingdata.com/2018/03/05/making-the-count/,FlowingData,1200,687,en_US,,,,,,,,,
121,Python 2 EOL will be 2020-01-01,https://changelog.com/news/python-2-eol-will-be-20200101-NRw2,2018-03-14T13:33:41,newsblur,website,"Guido van Rossum, Python's BDFL (for life):  Let's not play games with semantics. The way I see the situation for 2.7 is that EOL is January 1st, 2020, and there will be no updates, not even source-only security patches, after that date. Support (from the core devs, the PSF, and python.org) stops completely on that dat...",,http://feedproxy.google.com/~r/thechangelog/~3/zcpsno0hcug/python-2-eol-will-be-20200101-NRw2,Changelog,,,en_US,,,,,,,,,
109,"""You have to be run by ideas not hierarchy..."" - Steve Jobs",https://changelog.com/news/you-have-to-be-run-by-ideas-not-hierarchy-steve-jobs-Jdb,2018-03-04T13:34:30,newsblur,website,"Steve Jobs, in his last interview with Walt Mossberg and Kara Swisher at the All Things Digital's D8 Conference in 2010. Steve died a year later.  We're organized like a start up. We're the biggest startup on the planet. There's tremendous teamwork at the top of the company, which filters down to tremendous teamwork th...",,http://feedproxy.google.com/~r/thechangelog/~3/UH1BhkkK8tI/you-have-to-be-run-by-ideas-not-hierarchy-steve-jobs-Jdb,Changelog,,,en_US,,,,,,,,,
119,Robot Future,https://xkcd.com/1968/,2018-03-16T19:29:27,newsblur,,,,https://xkcd.com/1968/,,,,,,,,,,,,,
124,Facebook Insider Says Warnings About Data Safety Went Unheeded By Executives,https://www.pbs.org/wgbh/frontline/article/facebook-insider-says-warnings-about-data-safety-went-unheeded-by-executives/,2018-03-21T14:49:51,newsblur,article,"A manager who worked on privacy issues at Facebook told FRONTLINE that he raised red flags to company executives more than five years ago about the risks that users' personal data could be inappropriately obtained and misused, but said his warnings went unheeded.",https://i1.wp.com/www.pbs.org/wgbh/frontline/wp-content/uploads/2018/03/GettyImages-144717349.jpg?resize=1200%2C630,https://www.pbs.org/wgbh/frontline/article/facebook-insider-says-warnings-about-data-safety-went-unheeded-by-executives/,FRONTLINE,1200,630,,,,,,,,,,
99,"No bang, just fizzle: Why Apple’s iPad flopped as a news platform",https://dankennedy.net/2018/02/06/no-bang-just-fizzle-why-apples-ipad-flopped-as-a-news-platform/,2018-02-09T14:38:58,newsblur,article,"Previously published at WGBHNews.org. Of all the good technological innovations that were supposedly going to rescue the news business from the bad technological innovations that had laid it low, p…",https://dankennedy.files.wordpress.com/2018/02/6217075538_8fc2704970_z.jpg,https://dankennedy.net/2018/02/06/no-bang-just-fizzle-why-apples-ipad-flopped-as-a-news-platform/,Media Nation,640,480,en_US,,,,,,,,,
118,Opinion | The ‘Avengers: Infinity War’ trailer reminds me why I like Marvel movies,https://www.washingtonpost.com/news/act-four/wp/2018/03/16/the-avengers-infinity-war-trailer-reminds-me-why-i-like-marvel-movies/,2018-03-17T15:17:19,newsblur,article,Marvel has actually made its heroes likable people. The prospect of seeing them all on screen together is genuinely exciting.,https://www.washingtonpost.com/resizer/BZvW1QjBEIQGDNJNUkp2ukIAEho=/1484x0/arc-anglerfish-washpost-prod-washpost.s3.amazonaws.com/public/7LQPM74ACA67TLJ5DGZLAU72KI.jpg,http://www.washingtonpost.com/news/act-four/wp/2018/03/16/the-avengers-infinity-war-trailer-reminds-me-why-i-like-marvel-movies/,Washington Post,,,,,,,,,,,,
115,"When local media struggles, so does our democracy",https://www.seattletimes.com/pacific-nw-magazine/when-local-media-struggles-so-does-our-democracy/,2018-03-09T01:05:33,instapaper,article,"With fewer news outlets, and fewer employees, local journalism  is a troubled — but still essential — institution.",https://static.seattletimes.com/wp-content/uploads/2018/03/NorthCreek_takeover-1200x630.jpg,https://www.seattletimes.com/pacific-nw-magazine/when-local-media-struggles-so-does-our-democracy/,The Seattle Times,1200,630,,,,,,,,,,
116,On Django's longevity,https://www.b-list.org/weblog/2018/feb/22/teenage-django/,2018-02-22T14:02:35,instapaper,,,,https://www.b-list.org/weblog/2018/feb/22/teenage-django/,,,,,,,,,,,,,
95,Perspective | ‘What Were You Thinking’ is a podcast parents need to hear,https://www.washingtonpost.com/news/parenting/wp/2018/01/17/what-were-you-thinking-is-a-podcast-parents-need-to-hear/,2018-01-29T17:37:28,instapaper,article,A new podcast sheds light on teens may do the things they do.,https://www.washingtonpost.com/resizer/mADM_r8xSvJB2wJoHTvmifQsI6U=/1484x0/arc-anglerfish-washpost-prod-washpost.s3.amazonaws.com/public/T2XJCDE4DYZKDHQZDAHHAWXG3Y.jpg,https://www.washingtonpost.com/news/parenting/wp/2018/01/17/what-were-you-thinking-is-a-podcast-parents-need-to-hear/,Washington Post,,,,,,,,,,,,
123,The Iraq War and the Inevitability of Ignorance,https://www.theatlantic.com/international/archive/2018/03/iraq-war-anniversary-fifty-first-state/555986/,2018-03-21T01:09:03,instapaper,article,The U.S. is destined to keep overlearning the lessons of the last conflict.,https://cdn.theatlantic.com/assets/media/img/mt/2018/03/Fallows_Master_Sgt._Cecilio_Ricardo_DVIDS/facebook.jpg?1522767812,https://www.theatlantic.com/international/archive/2018/03/iraq-war-anniversary-fifty-first-state/555986/,The Atlantic,,,en_US,,,,,,,,,
41,Australian convict pirates in Japan: evidence of 1830 voyage unearthed,http://www.theguardian.com/australia-news/2017/may/28/australian-convict-pirates-in-japan-evidence-of-1830-voyage-unearthed,2017-05-29T12:21:28,instapaper,article,Exclusive: Fresh translations of samurai accounts of ‘barbarian’ ship arriving at the height of Japan’s isolation corroborate a story long dismissed as fantasy,https://i.guim.co.uk/img/media/e84717abd9d33eb8fe966817222f0b7cee767503/0_182_2578_1547/master/2578.jpg?w=1200&h=630&q=55&auto=format&usm=12&fit=crop&crop=faces%2Centropy&bm=normal&ba=bottom%2Cleft&blend64=aHR0cHM6Ly91cGxvYWRzLmd1aW0uY28udWsvMjAxOC8wMS8zMS9mYWNlYm9va19kZWZhdWx0LnBuZw&s=b1fe84336db0baf908120b5c35f3c273,http://www.theguardian.com/australia-news/2017/may/28/australian-convict-pirates-in-japan-evidence-of-1830-voyage-unearthed,the Guardian,1200,720,,,,,,,,,,
129,Making mistakes,https://www.b-list.org/weblog/2018/mar/20/mistakes/,2018-03-23T14:31:47,newsblur,,,,https://www.b-list.org/weblog/2018/mar/20/mistakes/,,,,,,,,,,,,,
136,How the Cohen Raids and Trump’s Reactions Edge Us Toward Confrontation,https://www.lawfareblog.com/how-cohen-raids-and-trumps-reactions-edge-us-toward-confrontation,2018-04-12T00:07:30,newsblur,article,"Evidence supporting the warrant application likely exceeded what is legally required, which makes Cohen’s situation, and Trump’s, grave.",https://lawfare.s3-us-west-2.amazonaws.com/staging/s3fs-public/39501756381_ed918ddec2_z.jpg,https://www.lawfareblog.com/how-cohen-raids-and-trumps-reactions-edge-us-toward-confrontation,Lawfare,,,,,,,,,,2018-04-12T18:35:39-04:00,https://lawfare.s3-us-west-2.amazonaws.com/staging/styles/thumbnail/s3/pictures/picture-16-1431624460.jpg?itok=EZ6k24MY,
139,Let's stop talking about how we value local journalism and do something,https://www.poynter.org/news/lets-stop-talking-about-how-we-value-local-journalism-and-do-something,2018-04-06T18:23:12,instapaper,,,https://www.poynter.org/sites/default/files/2018-04/shutterstock_1042043326_0.jpg,https://www.poynter.org/news/lets-stop-talking-about-how-we-value-local-journalism-and-do-something,Poynter,,,,,,,,,image/jpeg,,,
132,Arena,https://paraicmcgloughlin.com/arena/,2018-04-16T14:32:43,newsblur,website,,,https://paraicmcgloughlin.com/arena/,PÁRAIC MC GLOUGHLIN,,,,,,,,,,,,
131,How One Joke on “Roseanne” Explains the Show,https://www.newyorker.com/magazine/2018/04/23/how-one-joke-on-roseanne-explains-the-show,2018-04-18T04:03:56,instapaper,article,"You can’t understand who you are unless you know your history. That probably goes for sitcoms, too.","https://media.newyorker.com/photos/5ace674c4caa416a21182a70/16:9/w_1200,h_630,c_limit/180423_r31928.jpg",https://www.newyorker.com/magazine/2018/04/23/how-one-joke-on-roseanne-explains-the-show,The New Yorker,,,en_US,,,,,,,,,
137,Paul Ryan Personifies the Devil's Bargain the GOP Struck With Trump,https://www.theatlantic.com/politics/archive/2018/04/paul-ryan-personifies-the-devils-bargain-the-gop-struck-with-trump/557783/,2018-04-11T21:14:53,instapaper,article,"The outgoing House speaker, more than any other lawmaker, paved the path for congressional Republicans’ subjugation to the president.",https://cdn.theatlantic.com/assets/media/img/mt/2018/04/AP_18039621184923/facebook.jpg?1523467785,https://www.theatlantic.com/politics/archive/2018/04/paul-ryan-personifies-the-devils-bargain-the-gop-struck-with-trump/557783/,The Atlantic,,,en_US,,,,,,,,,
134,Tariffs Are a Bad Way to Deal With China's Trade Practices,https://www.theatlantic.com/international/archive/2018/04/what-did-you-do-in-the-trade-war-daddy/557573/,2018-04-14T18:31:34,newsblur,article,There is a problem with China. But what the U.S. is doing to solve it won’t work.,https://cdn.theatlantic.com/assets/media/img/mt/2018/04/RTX5LE3G/facebook.jpg?1523369796,https://www.theatlantic.com/international/archive/2018/04/us-china-trade-war/557573/?utm_source=feed,The Atlantic,,,en_US,,,,,,,,,
130,"Since 2016, Half of All Coral in the Great Barrier Reef Has Died",https://www.theatlantic.com/amp/article/558302/?__twitter_impression=true,2018-04-19T02:17:55,instapaper,,,,https://www.theatlantic.com/amp/article/558302/?__twitter_impression=true,,,,,,,,,,,,,
126,"From Silva to McGregor, the Distance Trap Is the Most Powerful Principle in MMA",https://sports.vice.com/en_us/article/zmgbb4/from-silva-to-mcgregor-the-distance-trap-is-the-most-powerful-principle-in-mma,2018-03-20T14:27:34,instapaper,article,"Control of distance remains one of the few common factors we can point to in top fighters from boxing, kickboxing, Muay Thai and mixed martial arts.","https://video-images.vice.com/articles/5aaa9de984605a000c3480fb/lede/1521132780686-USATSI_10242037.jpeg?crop=1xw:0.8429xh;0xw,0.0724xh&resize=1200:*",https://sports.vice.com/en_us/article/zmgbb4/from-silva-to-mcgregor-the-distance-trap-is-the-most-powerful-principle-in-mma,Sports,1200,675,en_us,,,,,,image/jpeg,,,
133,“Jane the Virgin” Is Not a Guilty Pleasure,https://www.newyorker.com/magazine/2018/03/12/jane-the-virgin-is-not-a-guilty-pleasure,2018-04-10T15:31:53,instapaper,article,"Instead, the show is a joyful manifesto against that very putdown.","https://media.newyorker.com/photos/5a9861c7dd72aa7b5e3f0a21/16:9/w_1200,h_630,c_limit/180312_r31644_rd.jpg",https://www.newyorker.com/magazine/2018/03/12/jane-the-virgin-is-not-a-guilty-pleasure,The New Yorker,,,en_US,,,,,,,,,
135,Michael Cohen and the End Stage of the Trump Presidency,https://www.newyorker.com/news/news-desk/michael-cohen-and-the-end-stage-of-the-trump-presidency,2018-04-14T23:27:48,instapaper,article,"The raid on the offices of President Trump’s personal lawyer makes clear that Trump’s battle with the special counsel, Robert Mueller, is entering its final chapter.","https://media.newyorker.com/photos/5ad2316fcd7220727ab3471e/16:9/w_1200,h_630,c_limit/Davidson-Cohen-end-phrase-of-Trump-presidency.jpg",https://www.newyorker.com/news/news-desk/michael-cohen-and-the-end-stage-of-the-trump-presidency,The New Yorker,,,en_US,,,,,,,,,
138,Going Offline,http://alistapart.com/article/going-offline,2018-04-11T18:32:26,instapaper,,"In this excerpt from Going Offline, Jeremy Keith introduces us to Service Workers, a critical component of Progressive Web Apps.",http://alistapart.com/d/excerptillustration_300.png,http://alistapart.com/article/going-offline,,,,,,,,,,,,,
125,Will We Ever Learn What Bob Mueller Knows?,https://lawfareblog.com/will-we-ever-learn-what-bob-mueller-knows,2018-03-21T18:13:05,instapaper,article,It’s a suprisingly complicated question that boils down to how Mueller imagines his role as special counsel.,,https://lawfareblog.com/will-we-ever-learn-what-bob-mueller-knows,Lawfare,,,,,,,,,,2018-03-24T09:54:21-04:00,https://lawfare.s3-us-west-2.amazonaws.com/staging/styles/thumbnail/s3/pictures/picture-435-1517246650.png?itok=uxeCJfHj,
142,Right Click,https://xkcd.com/1975/,2018-04-02T02:24:26,newsblur,,,,https://xkcd.com/1975/,,,,,,,,,,,,,
151,The Missing Building Blocks of the Web,https://anildash.com/2018/03/22/he-missing-building-blocks-of-the-web/,2018-04-22T00:07:44,instapaper,blog,"At a time when millions are losing trust in the the web’s biggest sites, it’s worth revisiting the idea that the web was supposed to be made out of countless little sites. Here’s a look at the neglected technologies that were supposed to make it possible. Though",https://anildash.com/content/images/2018/04/building-blocks-berries-01.jpeg,https://anildash.com/2018/03/22/he-missing-building-blocks-of-the-web/,Anil Dash,2000,2000,,,,,,,,,,
140,How community news can solve the problems of parachute journalism,https://ijnet.org/en/blog/how-community-news-can-solve-problems-parachute-journalism,2018-03-31T21:23:22,instapaper,,"Inside the growing push toward locally focused journalism around the world, from Ferguson, Missouri to Rio de Janeiro.",https://ijnet.org/sites/default/files/6270580145_fc4ea5608b_b.jpg,https://ijnet.org/en/blog/how-community-news-can-solve-problems-parachute-journalism,,,,,,,,,,,,,
143,"Jack Johnson, boxer jailed under Jim Crow, is being considered by Trump for pardon",https://www.washingtonpost.com/news/early-lead/wp/2018/04/21/who-is-jack-johnson-the-boxer-trump-is-considering-for-posthumous-pardon/,2018-04-22T01:35:50,newsblur,article,The first black heavyweight champion was convicted by an all-white jury in 1913 for crossing state lines with a white woman.,https://www.washingtonpost.com/resizer/NDK1w78vQWDvDZeLJ0uqzf_qfIs=/1484x0/arc-anglerfish-washpost-prod-washpost.s3.amazonaws.com/public/7IWAXNJQZUZMZEDA5ST4M7QY4M.jpg,https://www.washingtonpost.com/news/early-lead/wp/2018/04/21/who-is-jack-johnson-the-boxer-trump-is-considering-for-posthumous-pardon/?noredirect=on&utm_term=.83840c2c992c,Washington Post,,,,,,,,,,,,
152,Taking Children from Their Parents Is a Form of State Terror,https://www.newyorker.com/news/our-columnists/taking-children-from-their-parents-is-a-form-of-state-terror,2018-05-11T15:29:06,newsblur,article,"In Putin’s Russia, threatening to separate families is a way to rule by fear. It’s a lesson the Trump Administration seems to be learning.","https://media.newyorker.com/photos/5af30d8c79f6430aaa0fa3d5/16:9/w_1200,h_630,c_limit/Gessen-Taking-Children-from-Parents-Form-of-State-Terror.jpg",https://www.newyorker.com/news/our-columnists/taking-children-from-their-parents-is-a-form-of-state-terror?mbid=nl_Daily+050918&CNDID=36094959&spMailingID=13475791&spUserID=MTMzMTgzNzU1OTgxS0&spJobID=1400829189&spReportId=MTQwMDgyOTE4OQS2,The New Yorker,,,en_US,,,,,,,,,
141,The Last Generation,https://www.pbs.org/wgbh/frontline/article/the-last-generation/,2018-04-06T22:42:42,newsblur,article,"Explore an island nation threatened by climate change through the eyes of three children who call call it home. FRONTLINE and The GroundTruth Project present ""The Last Generation."" ",https://i1.wp.com/www.pbs.org/wgbh/frontline/wp-content/uploads/2018/04/last_gen_thumb.jpg?resize=1200%2C630,https://www.pbs.org/wgbh/frontline/article/the-last-generation/,FRONTLINE,1200,630,,,,,,,,,,
144,Clutter,https://xkcd.com/1983/,2018-04-21T20:09:28,newsblur,,,,https://xkcd.com/1983/,,,,,,,,,,,,,
153,The scariest chart in Mary Meeker’s slide deck for newspapers has gotten even a teeny bit scarier,http://www.niemanlab.org/2018/05/the-scariest-chart-in-mary-meekers-slide-deck-for-newspapers-has-gotten-even-a-teeny-bit-scarier/,2018-05-30T23:29:26,instapaper,article,"Since 2011, the share of Americans' media consumption that happens in print has dropped about 40 percent. But the share of American ad dollars that go to print has dropped more than 60 percent.",http://www.niemanlab.org/images/mary-meeker-adshare-2017-700x525.png,http://www.niemanlab.org/2018/05/the-scariest-chart-in-mary-meekers-slide-deck-for-newspapers-has-gotten-even-a-teeny-bit-scarier/,Nieman Lab,700,525,,,,,,,,,,
145,Morning News,https://xkcd.com/1996/,2018-05-22T17:30:24,newsblur,,,,https://xkcd.com/1996/,,,,,,,,,,,,,
149,"Opinion | Goodbye, ‘Brooklyn Nine-Nine.’ And thank you.",https://www.washingtonpost.com/news/act-four/wp/2018/05/11/goodbye-brooklyn-nine-nine-and-thank-you/,2018-05-11T16:41:45,newsblur,article,Our new reality couldn't keep the series alive forever.,https://www.washingtonpost.com/resizer/xug5yO395ubAyNZX7MZGtI12V2U=/1484x0/arc-anglerfish-washpost-prod-washpost.s3.amazonaws.com/public/5NKG46ZRSE3M7K2XSSS6N6TP6E.jpg,http://www.washingtonpost.com/news/act-four/wp/2018/05/11/goodbye-brooklyn-nine-nine-and-thank-you/,Washington Post,,,,,,,,,,,,
127,Computer science faces an ethics crisis. The Cambridge Analytica scandal proves it. - The Boston Globe,https://www.bostonglobe.com/ideas/2018/03/22/computer-science-faces-ethics-crisis-the-cambridge-analytica-scandal-proves/IzaXxl2BsYBtwM4nxezgcP/story.html,2018-03-28T13:03:52,instapaper,article,Dynamite and the nuclear bomb led to soul-searching among chemists and physicists. Computer scientists have not yet witnessed negative consequences of their work — and behave accordingly. ,https://www.bostonglobe.com/rf/image_585w/Boston/2011-2020/2018/03/22/BostonGlobe.com/Ideas/Images/30286f61-65c3-4350-8717-97afcfe0d231.jpg,https://www.bostonglobe.com/ideas/2018/03/22/computer-science-faces-ethics-crisis-the-cambridge-analytica-scandal-proves/IzaXxl2BsYBtwM4nxezgcP/story.html,BostonGlobe.com,,,,,,,,,,,,
147,"I’m Not Black, I’m Kanye",https://www.theatlantic.com/entertainment/archive/2018/05/im-not-black-im-kanye/559763/,2018-05-09T23:33:58,instapaper,article,"Kanye West wants freedom—white freedom.
",https://cdn.theatlantic.com/assets/media/img/mt/2018/05/glennharvey_theatlantic_2018_05_06_final/facebook.jpg?1525687701,https://www.theatlantic.com/entertainment/archive/2018/05/im-not-black-im-kanye/559763/,The Atlantic,,,en_US,,,,,,,,,
150,Cliff Huxtable Was Bill Cosby’s Sickest Joke,https://www.nytimes.com/2018/04/26/arts/television/cosby-show-african-americans.html,2018-04-27T20:09:53,instapaper,article,"Mr. Cosby’s signature TV character was a patient, wise father figure. In other words, our critic writes, the ideal cover for terrible behavior.",https://static01.nyt.com/images/2018/04/27/arts/27cosby-morris2/27cosby-morris2-facebookJumbo-v2.jpg,https://www.nytimes.com/2018/04/26/arts/television/cosby-show-african-americans.html,,,,,,,,,,,,,
154,A Photo for the Ages of Our Unfolding Disaster,https://talkingpointsmemo.com/edblog/a-photo-for-the-ages-of-our-unfolding-disaster,2018-06-11T01:09:50,newsblur,article,In the aftermath of what can only be called the debacle of the G-7 Summit this photograph is rapidly taking...,,https://talkingpointsmemo.com/edblog/a-photo-for-the-ages-of-our-unfolding-disaster,TPM,,,,,,,,,,,,
146,The Case for Having a Hobby,https://www.nytimes.com/2018/05/10/smarter-living/the-case-for-hobbies-ideas.html,2018-05-10T16:33:14,instapaper,article,"Hobbies can help remind you that work isn’t everything. Life isn’t just for productivity, and doing something for fun can be its own reward.",https://static01.nyt.com/images/2018/05/10/nyregion/10sl-hobby/10sl-hobby-facebookJumbo.jpg,https://www.nytimes.com/2018/05/10/smarter-living/the-case-for-hobbies-ideas.html,,,,,,,,,,,,,
148,Opinion | ‘Avengers: Infinity War’ is a profoundly sad portrait of an abusive family,https://www.washingtonpost.com/news/act-four/wp/2018/05/03/avengers-infinity-war-is-a-profoundly-sad-portrait-of-an-abusive-family/,2018-05-09T20:29:00,instapaper,article,Thanos is a monster. He's more like the rest of us than we'd like to think.,https://www.washingtonpost.com/resizer/Gau69-EKXOYgLTaVTaQcey6eW_E=/1484x0/arc-anglerfish-washpost-prod-washpost.s3.amazonaws.com/public/TUOVVLSZHY5IDHL6FOCUZOAN34.jpg,https://www.washingtonpost.com/news/act-four/wp/2018/05/03/avengers-infinity-war-is-a-profoundly-sad-portrait-of-an-abusive-family/,Washington Post,,,,,,,,,,,,
172,"Steve Ditko, co-creator of Spider-Man and Doctor Strange, dies at 90",http://www.latimes.com/local/obituaries/la-me-steve-ditko-20180706-story.html,2018-07-07T16:27:39,newsblur,article,"Steve Ditko, who co-created Marvel superheroes Spider-Man and Doctor Strange with Stan Lee, has died. The comic book artist and writer was 90. ",http://www.latimes.com/resizer/d2WXHPuoHaT4ceZNr7wyjxJNlqk=/1200x0/www.trbimg.com/img-5b43e8b4/turbine/la-me-steve-ditko-20180706,http://www.latimes.com/local/obituaries/la-me-steve-ditko-20180706-story.html,latimes.com,,,en_US,,,,,,,,,
155,How The Supreme Court Could End Extreme Partisan Gerrymandering This Month,https://fivethirtyeight.com/features/how-the-supreme-court-could-end-extreme-partisan-gerrymandering-this-month/,2018-06-07T17:56:50,newsblur,article,And how it could also keep it going.,https://fivethirtyeight.com/wp-content/uploads/2018/01/gerrymandering-tradeoffs-16x9-transparent.png?w=1600,http://fivethirtyeight.com/features/how-the-supreme-court-could-end-extreme-partisan-gerrymandering-this-month/,FiveThirtyEight,575,431,en_US,,,,,,,,,
156,America Is Fumbling Its Most Important Relationship,https://www.theatlantic.com/international/archive/2018/05/china-trump/561359/,2018-06-03T14:03:53,newsblur,article,The United States has a China problem—and pundits and politicians are making it worse.,https://cdn.theatlantic.com/assets/media/img/mt/2018/05/RTS1RI1J/facebook.jpg?1527518056,https://www.theatlantic.com/international/archive/2018/05/china-trump/561359/?utm_source=feed,The Atlantic,,,en_US,,,,,,,,,
158,America is losing the battle against robocalls,https://www.economist.com/graphic-detail/2018/05/23/america-is-losing-the-battle-against-robocalls,2018-05-24T03:21:09,newsblur,article,Fraudsters persist regardless of the consequences,https://cdn.static-economist.com/sites/default/files/20180526_WOC451.png,https://www.economist.com/blogs/graphicdetail/2018/05/daily-chart-16?fsrc=rss,The Economist,,,,,,,,,,,,
