id,feed,site_name,description,title,url,longitude,latitude,scrape,_url,date,type,image,locale,image:height,image:width,article:published_time,image:secure_url,image:url,updated_time,image:type,fb_appid,streetaddress,city,state
113,newsblur,Media Nation,What’s next for The Boston Globe and the burgeoning #MeToo sexual-harassment story now dominating virtually every facet of society? The Globe is the only local news organization with the size…,What’s next for the Globe after Brian McGrory’s message to readers?,https://dankennedy.net/2017/12/23/whats-next-for-the-globe-after-brian-mcgrorys-message-to-readers/,,,,https://dankennedy.net/2017/12/23/whats-next-for-the-globe-after-brian-mcgrorys-message-to-readers/,2017-12-24 00:15:28.000000,article,https://secure.gravatar.com/blavatar/aa09390c6b26329fd16c35859ad45875?s=200&ts=1514085714,en_US,200,200,,,,,,,,,
114,newsblur,,,Virtual Assistant,https://xkcd.com/1931/,,,,https://xkcd.com/1931/,2017-12-23 17:02:55.000000,,,,,,,,,,,,,,
115,newsblur,,,California’s December Inferno,https://earthobservatory.nasa.gov/IOTD/view.php?id=91466&src=eorss-iotd,,,,https://earthobservatory.nasa.gov/IOTD/view.php?id=91466&src=eorss-iotd,2017-12-21 02:51:36.000000,,,,,,,,,,,,,,
116,newsblur,,,Smoke from the Thomas Fire,https://earthobservatory.nasa.gov/NaturalHazards/view.php?id=91440&src=eorss-nh,,,,https://earthobservatory.nasa.gov/NaturalHazards/view.php?id=91440&src=eorss-nh,2017-12-15 23:49:00.000000,,,,,,,,,,,,,,
117,newsblur,,,Seven Years,https://xkcd.com/1928/,,,,https://xkcd.com/1928/,2017-12-14 02:21:45.000000,,,,,,,,,,,,,,
118,newsblur,,,California Wildfire Emissions,https://earthobservatory.nasa.gov/IOTD/view.php?id=91427&src=eorss-iotd,,,,https://earthobservatory.nasa.gov/IOTD/view.php?id=91427&src=eorss-iotd,2017-12-13 02:10:06.000000,,,,,,,,,,,,,,
119,newsblur,,,Fires Continue to Rage in Southern California,https://earthobservatory.nasa.gov/NaturalHazards/view.php?id=91421&src=eorss-nh,,,,https://earthobservatory.nasa.gov/NaturalHazards/view.php?id=91421&src=eorss-nh,2017-12-11 21:46:06.000000,,,,,,,,,,,,,,
120,newsblur,Slate Magazine,I discovered Axe the usual way.,What Happens When a Grown Woman Wears Axe Body Spray for a Week?,http://www.slate.com/articles/double_x/doublex/2013/10/axe_men_s_body_spray_what_happens_when_a_woman_wears_it_for_a_week.html,,,,http://www.slate.com/articles/double_x/doublex/2013/10/axe_men_s_body_spray_what_happens_when_a_woman_wears_it_for_a_week.html,2017-12-09 23:51:55.000000,article,http://www.slate.com/content/dam/slate/articles/double_x/doublex/2013/10/131021_DX_AxeDaliaAndSon.jpg.CROP.promo-large.jpg,,,,,,,,,,,,
121,newsblur,,,Earth Matters Blog - Why the SoCal Fires are So Fierce,https://earthobservatory.nasa.gov/blogs/earthmatters/?p=8001&src=eorss-blogs,,,,https://earthobservatory.nasa.gov/blogs/earthmatters/?p=8001&src=eorss-blogs,2017-12-07 21:46:36.000000,,,,,,,,,,,,,,
122,newsblur,,,Smoke Over Southern California,https://earthobservatory.nasa.gov/NaturalHazards/view.php?id=91387&src=eorss-nh,,,,https://earthobservatory.nasa.gov/NaturalHazards/view.php?id=91387&src=eorss-nh,2017-12-07 21:45:07.000000,,,,,,,,,,,,,,
123,newsblur,,,Wildfire Lights Up Ventura,https://earthobservatory.nasa.gov/NaturalHazards/view.php?id=91376&src=eorss-nh,,,,https://earthobservatory.nasa.gov/NaturalHazards/view.php?id=91376&src=eorss-nh,2017-12-05 20:49:10.000000,,,,,,,,,,,,,,
124,newsblur,FRONTLINE,"Poverty can follow children into adulthood, affecting their long-term physical and mental health, and making it harder to finish school and climb out of poverty.",How Poverty Can Follow Children Into Adulthood,https://www.pbs.org/wgbh/frontline/article/how-poverty-can-follow-children-into-adulthood/,,,,https://www.pbs.org/wgbh/frontline/article/how-poverty-can-follow-children-into-adulthood/,2017-11-23 13:07:57.000000,article,https://i1.wp.com/www.pbs.org/wgbh/frontline/wp-content/uploads/2017/11/GettyImages-515562152.jpg?resize=1200%2C630,,630,1200,,,,,,,,,
125,newsblur,Washington Post,"If you're having trouble sorting out bumblers from predators, serial behavior is a good way to tell what's up.","Opinion | Did Al Franken make a bad decision, or is he a creep? Look for the pattern.",https://www.washingtonpost.com/news/act-four/wp/2017/11/20/did-al-franken-make-a-bad-decision-or-is-he-a-creep-look-for-the-pattern/,,,,http://www.washingtonpost.com/news/act-four/wp/2017/11/20/did-al-franken-make-a-bad-decision-or-is-he-a-creep-look-for-the-pattern/,2017-11-21 14:46:05.000000,article,https://www.washingtonpost.com/rf/image_1484w/2010-2019/WashingtonPost/2017/11/20/National-Politics/Images/Trump_Judges_90086-2db38.jpg?t=20170517,,,,,,,,,,,,
126,newsblur,TPM,Yesterday I appeared on a panel about digital publishers who are &#8216;pivoting to video&#8217;. I&#8217;ve written about this before. But...,There's a Digital Media Crash. But No One Will Say It,http://talkingpointsmemo.com/edblog/theres-a-digital-media-crash-but-no-one-will-say-it,,,,http://talkingpointsmemo.com/edblog/theres-a-digital-media-crash-but-no-one-will-say-it,2017-11-19 13:14:02.000000,article,https://dawm7kda6y2v0.cloudfront.net/uploads/2016/08/gujo96kkja8sbxb2takj-654x362.jpg,,,,,,,,,,,,
127,newsblur,,,October Scorches Records in the Northeast,https://earthobservatory.nasa.gov/IOTD/view.php?id=91278&src=eorss-iotd,,,,https://earthobservatory.nasa.gov/IOTD/view.php?id=91278&src=eorss-iotd,2017-11-16 02:49:17.000000,,,,,,,,,,,,,,
128,newsblur,Washington Post,"We want to believe that terrible behavior is a hindrance to great art, not that it informs it.",Opinion | The sexual harassment accusations against Louis C.K. actually make his work make more sense,https://www.washingtonpost.com/news/act-four/wp/2017/11/10/the-sexual-harassment-accusations-against-louis-c-k-actually-make-his-work-make-more-sense/,,,,http://www.washingtonpost.com/news/act-four/wp/2017/11/10/the-sexual-harassment-accusations-against-louis-c-k-actually-make-his-work-make-more-sense/,2017-11-13 01:51:11.000000,article,https://www.washingtonpost.com/rf/image_1484w/2010-2019/WashingtonPost/2017/11/10/Production/Outlook/Images/2017-11-10T001322Z_1_LYNXMPEDA900D-ORVPE_RTROPTP_3_PEOPLE-US-PEOPLE-LOUIS-CK.jpg?t=20170517,,,,,,,,,,,,
129,newsblur,,,Twitter Verification,https://xkcd.com/1914/,,,,https://xkcd.com/1914/,2017-11-10 18:28:53.000000,,,,,,,,,,,,,,
130,newsblur,Washington Post,It's not enough to punish the Harvey Weinsteins of the world. We have to make recompense to the people men like him hurt.,Opinion | Harassers are finally getting their comeuppance. What happens to the people they hurt?,https://www.washingtonpost.com/news/act-four/wp/2017/11/07/harassers-are-finally-getting-their-comeuppance-what-happens-to-the-people-they-hurt/,,,,http://www.washingtonpost.com/news/act-four/wp/2017/11/07/harassers-are-finally-getting-their-comeuppance-what-happens-to-the-people-they-hurt/,2017-11-08 15:47:37.000000,article,https://www.washingtonpost.com/rf/image_1484w/2010-2019/WashingtonPost/2017/11/03/National-Economy/Images/2017-11-02T181842Z_2_LYNXMPEDA11HO-ORVPE_RTROPTP_3_PEOPLE-US-PEOPLE-HARVEY-WEINSTEIN-TRIAL-0775.jpg?t=20170517,,,,,,,,,,,,
131,newsblur,Washington Post,"If Disney is going to try to pressure outlets through their film critics, film critics should stand up to corporate influence.","Opinion | Why I won’t be reviewing ‘The Last Jedi,’ or any other Disney movie, in advance",https://www.washingtonpost.com/news/act-four/wp/2017/11/06/why-i-wont-be-reviewing-the-last-jedi-or-any-other-disney-movie-in-advance/,,,,http://www.washingtonpost.com/news/act-four/wp/2017/11/06/why-i-wont-be-reviewing-the-last-jedi-or-any-other-disney-movie-in-advance/,2017-11-06 18:20:09.000000,article,https://www.washingtonpost.com/rf/image_1484w/2010-2019/WashingtonPost/2017/11/06/Weekend/Images/wk-lastjedi1110-1.jpg?t=20170517,,,,,,,,,,,,
132,newsblur,,,Defensive Profile,https://xkcd.com/1911/,,,,https://xkcd.com/1911/,2017-11-03 16:06:15.000000,,,,,,,,,,,,,,
133,newsblur,Washington Post,"Totally irrespective of Kevin Spacey's behavior, ""House of Cards"" promoted dumb ideas about Washington as savvy thinking.",Opinion | The allegations against Kevin Spacey got ‘House of Cards’ canceled. Good riddance.,https://www.washingtonpost.com/news/act-four/wp/2017/11/01/the-allegations-against-kevin-spacey-got-house-of-cards-canceled-good-riddance/,,,,http://www.washingtonpost.com/news/act-four/wp/2017/11/01/the-allegations-against-kevin-spacey-got-house-of-cards-canceled-good-riddance/,2017-11-02 18:52:33.000000,article,https://www.washingtonpost.com/rf/image_1484w/2010-2019/WashingtonPost/2017/10/31/Production/Daily/Style/Images/2017-10-31T180501Z_1_LYNXMPED9U1IL-ORVTV_RTROPTP_3_TELEVISION-US-PEOPLE-KEVINSPACEY-NETFLIX.jpg?t=20170517,,,,,,,,,,,,
134,newsblur,Washington Post,It's totally irresponsible to judge a work based on a 14-second clip--and it's worse to base your whole view of history on it.,Opinion | The debate over John Kelly and Ken Burns’s ‘The Civil War’ is making us stupider,https://www.washingtonpost.com/news/act-four/wp/2017/11/01/the-debate-over-john-kelly-and-ken-burnss-the-civil-war-is-making-us-stupider/,,,,http://www.washingtonpost.com/news/act-four/wp/2017/11/01/the-debate-over-john-kelly-and-ken-burnss-the-civil-war-is-making-us-stupider/,2017-11-01 20:21:22.000000,article,https://www.washingtonpost.com/pbox.php?url=http://www.washingtonpost.com/news/act-four/wp-content/uploads/sites/25/2014/04/AP110325020821_image.jpg&w=1484&op=resize&opt=1&filter=antialias&t=20170517,,,,,,,,,,,,
135,newsblur,,,Digital Resource Lifespan,https://xkcd.com/1909/,,,,https://xkcd.com/1909/,2017-10-30 17:44:04.000000,,,,,,,,,,,,,,
