id,feed,site_name,description,title,url,longitude,latitude,scrape,_url,date,type,image,locale,image:height,image:width,article:published_time,image:secure_url,image:url,updated_time,image:type,fb_appid,streetaddress,city,state
69,instapaper,Education Week - Rules for Engagement,Some students engage in so-called self-handicapping behaviors like procrastination in an attempt to protect themselves from the negative emotions they might feel if they fail at an academic task. How should teachers handle it?,The Unexpected Reason Some Students Procrastinate,http://blogs.edweek.org/edweek/rulesforengagement/2017/08/why_students_procrastinate-self-handicapping.html?cmp=SOC-SHR-FB,,,0,http://blogs.edweek.org/edweek/rulesforengagement/2017/08/why_students_procrastinate-self-handicapping.html,2017-08-09 16:12:32.000000,article,http://blogs.edweek.org/edweek/rulesforengagement/Procrastination-late-night_560x292blog_Getty.jpg,,,,,,,,,,,,
70,instapaper,Foreign Policy,Blaming the victim is the easiest way for people to sleep at night in a country where the government could crush you at any moment.,The Chinese Think Liu Xiaobo Was Asking For It,https://foreignpolicy.com/2017/07/11/the-chinese-think-liu-xiaobo-was-asking-for-it/,,,0,https://foreignpolicy.com/2017/07/11/the-chinese-think-liu-xiaobo-was-asking-for-it/,2017-07-14 01:01:09.000000,article,https://foreignpolicymag.files.wordpress.com/2017/07/gettyimages-107603032.jpg,,,,,,,,,,,,
71,instapaper,,Sometimes the president’s tweets program his go-to cable morning show. And sometimes the show programs him.,"Watching ‘Fox & Friends,’ Trump Sees a Two-Way Mirror",https://www.nytimes.com/2017/07/19/arts/television/donald-trump-fox-friends.html,,,0,https://www.nytimes.com/2017/07/19/arts/television/donald-trump-fox-friends.html,2017-07-19 16:09:05.000000,article,https://static01.nyt.com/images/2017/07/20/arts/20FOXANDFRIENDS1/20FOXANDFRIENDS1-facebookJumbo.jpg,,,,,,,,,,,,
72,instapaper,,,Robert Whittaker interview - Karate's TUF guy - Blitz Martial Arts Magazine,https://www.blitzmag.net/people/bjj-mma/501-robert-whittaker-karate-is-the-foundation-of-my-striking,,,,https://www.blitzmag.net/people/bjj-mma/501-robert-whittaker-karate-is-the-foundation-of-my-striking,2017-07-13 19:31:46.000000,,,,,,,,,,,,,,
73,instapaper,,,Towards Channels 2.0 - Aeracode,http://www.aeracode.org/2017/7/11/towards-channels-20/,,,,http://www.aeracode.org/2017/7/11/towards-channels-20/,2017-07-15 19:25:01.000000,,,,,,,,,,,,,,
74,instapaper,WSJ,Facial-recognition systems crunch data from ubiquitous cameras in a vast social-engineering experiment. Petty offenders face public shaming.,China’s All-Seeing Surveillance State Is Reading Its Citizens’ Faces,https://www.wsj.com/articles/the-all-seeing-surveillance-state-feared-in-the-west-is-a-reality-in-china-1498493020,,,,https://www.wsj.com/articles/the-all-seeing-surveillance-state-feared-in-the-west-is-a-reality-in-china-1498493020,2017-06-28 00:50:51.000000,article,https://si.wsj.net/public/resources/images/BN-UA278_0626RA_TOP_20170626104337.jpg,en_US,,,,,,,,,,,
75,instapaper,,"As the president celebrated his first anniversary in office, Filipinos took stock of the damage.","Opinion | Duterte, Year One",https://www.nytimes.com/2017/07/03/opinion/philippines-duterte.html,,,,https://www.nytimes.com/2017/07/03/opinion/philippines-duterte.html?nytmobile=0,2017-07-04 12:27:33.000000,article,https://static01.nyt.com/images/2017/07/04/opinion/03fantauzzo/03fantauzzo-facebookJumbo.jpg,,,,,,,,,,,,
76,instapaper,BostonGlobe.com,"As the paper prepares to leave Morrissey Boulevard, who better to write about the venerable structure, immortalized by his cinematic vision? ",‘Spotlight’ director: Boston Globe building was one of movie’s stars - The Boston Globe,https://www.bostonglobe.com/arts/movies/2017/06/15/spotlight-director-globe-building-was-one-movie-stars/Jv65VEOpK6lTkmCi2bDNpL/story.html,,,,https://www.bostonglobe.com/arts/movies/2017/06/15/spotlight-director-globe-building-was-one-movie-stars/Jv65VEOpK6lTkmCi2bDNpL/story.html,2017-06-17 03:12:30.000000,article,https://www.bostonglobe.com/rf/image_585w/Boston/2011-2020/2014/10/30/BostonGlobe.com/Lifestyle/Images/Spotlight14.jpg,,,,,,,,,,135 Morrissey Blvd.,Boston,MA
77,instapaper,,"Newly discovered fossils indicate Homo sapiens were present in Africa 300,000 years ago, scientists reported. Until now, the earliest evidence dated back just 195,000 years.","Oldest Fossils of Homo Sapiens Found in Morocco, Altering History of Our Species",https://www.nytimes.com/2017/06/07/science/human-fossils-morocco.html,,,,https://www.nytimes.com/2017/06/07/science/human-fossils-morocco.html,2017-06-12 21:55:13.000000,article,https://static01.nyt.com/images/2017/06/08/science/08FOSSIL1/08FOSSIL1-facebookJumbo.jpg,,,,,,,,,,,,
78,instapaper,NPR.org,"The few, tepid defenses of Bill Cosby during his criminal trial for sexual assault are an illustration of just how much his influence as Black America's emissary to the wider world has waned.",When What Was Good For Bill Cosby Was Good For Black America,https://www.npr.org/sections/codeswitch/2017/06/12/532242734/when-what-was-good-for-bill-cosby-was-good-for-black-america,,,,http://www.npr.org/sections/codeswitch/2017/06/12/532242734/when-what-was-good-for-bill-cosby-was-good-for-black-america,2017-06-14 00:50:00.000000,article,https://media.npr.org/assets/img/2017/06/09/gettyimages-693518676_wide-d166b6aadb5c4de106f3568417b380500f30e9e7.jpg?s=1400,,,,,,,,,,,,
79,instapaper,HWD,"Even if he weren’t Luke Skywalker, he’d probably be collecting lightsabers.","Star Wars Nerds, Mark Hamill Is One of You",https://www.vanityfair.com/hollywood/2017/05/mark-hamill-star-wars-nerd,,,,http://www.vanityfair.com/hollywood/2017/05/mark-hamill-star-wars-nerd,2017-05-30 02:13:16.000000,article,"https://media.vanityfair.com/photos/5925bcb67b959f02077a747e/16:9/w_1200,h_630,c_limit/t-mark-hamill-luke-skywalker-extra-5.jpg",,,,,,,,,,,,
80,instapaper,The Atlantic,The legend of the Confederate leader’s heroism and decency is based in the fiction of a person who never existed.,The Myth of the Kindly General Lee,https://www.theatlantic.com/politics/archive/2017/06/the-myth-of-the-kindly-general-lee/529038/,,,,https://www.theatlantic.com/politics/archive/2017/06/the-myth-of-the-kindly-general-lee/529038/,2017-06-05 11:38:18.000000,article,https://cdn.theatlantic.com/assets/media/img/mt/2017/06/RTX372WA/facebook.jpg?1496433350,en_US,,,,,,,,,,,
81,instapaper,Sports,The recent uproar over an MMA fighter's beatdown of a tai chi practitioner is a virtual case study for Bruce Lee's emphasis on real world application of the fighting arts.,Bruce Lee and the Art of Scientific Street Fighting,https://sports.vice.com/en_us/article/pae7v9/bruce-lee-and-the-art-of-scientific-street-fighting,,,,https://sports.vice.com/en_us/article/bruce-lee-and-the-art-of-scientific-street-fighting,2017-05-31 19:23:56.000000,article,"https://video-images.vice.com/articles/592db95197924a42940f4b1f/lede/1496767534852-brucelee39993.jpeg?crop=1xw:0.8152xh;0xw,0.0831xh&resize=1200:*",en_us,675,1200,,,,,image/jpeg,,,,
82,instapaper,mcclatchydc,"Trump’s first national security adviser, Michael Flynn, was paid as a foreign agent for Turkey even as he served as Trump’s primary foreign policy adviser.",Flynn stopped military plan Turkey opposed – after being paid as its agent,http://www.mcclatchydc.com/news/politics-government/white-house/article151149647.html,,,,http://www.mcclatchydc.com/news/politics-government/white-house/article151149647.html,2017-05-18 03:32:13.000000,article,http://www.mcclatchydc.com/news/politics-government/white-house/6cii4c/picture151149637/alternates/LANDSCAPE_1140/AP_17032738349708,,,,,,,,,,,,
83,instapaper,the Guardian,Exclusive: Fresh translations of samurai accounts of ‘barbarian’ ship arriving at the height of Japan’s isolation corroborate a story long dismissed as fantasy,Australian convict pirates in Japan: evidence of 1830 voyage unearthed,http://www.theguardian.com/australia-news/2017/may/28/australian-convict-pirates-in-japan-evidence-of-1830-voyage-unearthed,,,,http://www.theguardian.com/australia-news/2017/may/28/australian-convict-pirates-in-japan-evidence-of-1830-voyage-unearthed,2017-05-29 12:21:28.000000,article,https://i.guim.co.uk/img/media/e84717abd9d33eb8fe966817222f0b7cee767503/0_182_2578_1547/master/2578.jpg?w=1200&h=630&q=55&auto=format&usm=12&fit=crop&crop=faces%2Centropy&bm=normal&ba=bottom%2Cleft&blend64=aHR0cHM6Ly91cGxvYWRzLmd1aW0uY28udWsvMjAxNi8wNS8yNS9vdmVybGF5LWxvZ28tMTIwMC05MF9vcHQucG5n&s=4f717bc91660f6275a893de3824d3bbb,,720,1200,,,,,,,,,
84,instapaper,Lawfare,James Comey was preoccupied throughout the period he and President Trump were in office together with the need to protect the FBI from inquiries on investigative matters from the White House.,What James Comey Told Me About Donald Trump,https://www.lawfareblog.com/what-james-comey-told-me-about-donald-trump,,,,https://www.lawfareblog.com/what-james-comey-told-me-about-donald-trump,2017-05-19 03:01:58.000000,article,,,,,,,https://lawfare.s3-us-west-2.amazonaws.com/staging/styles/thumbnail/s3/pictures/picture-16-1431624460.jpg?itok=EZ6k24MY,2017-05-19T16:00:28-04:00,,,,,
85,instapaper,The New Yorker,A Senate panel’s request for information from a Treasury enforcement unit suggests a broader scope to its investigation.,The Senate Starts to Look at Trump’s Businesses,https://www.newyorker.com/business/adam-davidson/the-senate-starts-to-look-at-trumps-businesses,,,,http://www.newyorker.com/business/adam-davidson/the-senate-starts-to-look-at-trumps-businesses,2017-05-15 18:06:19.000000,article,"https://media.newyorker.com/photos/5916137abd3c95238e5c30ed/16:9/w_1200,h_630,c_limit/Davidson-Could-Donald-Trumps-Businesses-Become-Part-of-the-Russia-Probe.jpg",en_US,,,,,,,,,,,
86,instapaper,,The administration has offered no explanation for what lawful authority it used to carry out the strike to punish Syria for a chemical weapons attack.,"Watchdog Group Sues Trump Administration, Seeking Legal Rationale Behind Syria Strike",https://www.nytimes.com/2017/05/08/world/middleeast/syria-united-protect-democracy-trump-lawsuit.html,,,,https://www.nytimes.com/2017/05/08/world/middleeast/syria-united-protect-democracy-trump-lawsuit.html,2017-05-08 21:05:43.000000,article,https://static01.nyt.com/images/2017/05/09/world/09Syria-law/09Syria-law-facebookJumbo.jpg,,,,,,,,,,,,
87,instapaper,,"Though still mourning her “PBS NewsHour” co-anchor, Gwen Ifill, Ms. Woodruff continues to be a pioneering role model in journalism.","Judy Woodruff, the Woman of the Hour",https://www.nytimes.com/2017/05/06/style/judy-woodruff-pbs-newshour.html,,,,https://www.nytimes.com/2017/05/06/style/judy-woodruff-pbs-newshour.html?nytmobile=0,2017-05-07 12:31:35.000000,article,https://static01.nyt.com/images/2017/05/07/fashion/07WOODRUFF5-WEB/07WOODRUFF5-WEB-facebookJumbo.jpg,,,,,,,,,,,,
88,instapaper,,"For the first time since the Industrial Revolution, Britain went 24 hours without using coal to generate electricity, and expects to end all such use by 2025.","For First Time Since 1800s, Britain Goes a Day Without Burning Coal for Electricity",https://www.nytimes.com/2017/04/21/world/europe/britain-burning-coal-electricity.html,,,,https://www.nytimes.com/2017/04/21/world/europe/britain-burning-coal-electricity.html?nytmobile=0,2017-04-25 01:18:34.000000,article,https://static01.nyt.com/images/2017/04/22/world/22britain-3/22britain-3-facebookJumbo.jpg,,,,,,,,,,,,
89,instapaper,Vulture,"From its cinematographer to its cast, Black Panther doesn’t look like any of the other Marvel movies.",You’re Not Ready for Black Panther’s Stunning New Spin on Superhero Movies,http://www.vulture.com/2017/04/black-panther-looks-like-a-stunning-spin-on-superhero-movies.html,,,,http://www.vulture.com/2017/04/black-panther-looks-like-a-stunning-spin-on-superhero-movies.html,2017-04-25 12:10:47.000000,article,https://pixel.nymag.com/imgs/daily/vulture/2017/04/18/18-chadwick-black-panther.w1200.h630.jpg,,,,,,,,,,,,
90,instapaper,Longreads,"On the longevity of Maria Sharapova, who has built a brand beyond the bounds of her tennis stardom that has made her incredibly wealthy, but still striving for more.",The (Re)selling of Maria Sharapova ,https://longreads.com/2017/04/25/the-reselling-of-maria-sharapova/,,,,https://longreads.com/2017/04/25/the-reselling-of-maria-sharapova/,2017-04-26 02:50:41.000000,article,https://longreadsblog.files.wordpress.com/2017/04/ap_1603072040154784.jpg?w=1200,en_US,918,1200,,,,,,,,,
91,instapaper,,"The West tried to ignore “Muslims killing Muslims,” but the war in Syria has engulfed us all.",Opinion | Syria Changed the World,https://www.nytimes.com/2017/04/21/sunday-review/one-countrys-war-changed-the-world.html,,,,https://www.nytimes.com/2017/04/21/sunday-review/one-countrys-war-changed-the-world.html,2017-04-28 16:20:05.000000,article,https://static01.nyt.com/images/2017/04/23/opinion/sunday/23barnard/23barnard-facebookJumbo.jpg,,,,,,,,,,,,
92,instapaper,,"Two Harvard scholars argue that an unknown parchment copy of the Declaration, seemingly made in the 1780s, offers clues to the debate over the Constitution.",A New Parchment Declaration of Independence Surfaces. Head-Scratching Ensues.,https://www.nytimes.com/2017/04/21/arts/a-new-parchment-declaration-of-independence-surfaces-head-scratching-ensues.html,,,,https://www.nytimes.com/2017/04/21/arts/a-new-parchment-declaration-of-independence-surfaces-head-scratching-ensues.html?nytmobile=0,2017-04-23 13:09:58.000000,article,https://static01.nyt.com/images/2017/04/22/arts/22declaration-1/22declaration-facebookJumbo.jpg,,,,,,,,,,,,
93,instapaper,,Eleven years on the road doing standup has given the comedian a unique empathy for the people of this country.,Dave Chappelle Is an American Folk Hero,https://www.nytimes.com/2017/04/19/t-magazine/dave-chappelle-profile.html,,,,https://www.nytimes.com/2017/04/19/t-magazine/dave-chappelle-profile.html,2017-04-20 15:36:11.000000,article,https://static01.nyt.com/images/2017/04/19/t-magazine/chappelle-promo/chappelle-promo-facebookJumbo.jpg,,,,,,,,,,,,
94,instapaper,,"The Trump administration says its missions in Syria and Afghanistan sent a warning to North Korea, but repeated studies have found that notion to be baseless.",Do U.S. Strikes Send a ‘Message’ to Rivals? There’s No Evidence,https://www.nytimes.com/2017/04/21/world/do-us-strikes-send-a-message-to-rivals-theres-no-evidence.html,,,,https://www.nytimes.com/2017/04/21/world/do-us-strikes-send-a-message-to-rivals-theres-no-evidence.html?nytmobile=0,2017-04-22 01:44:33.000000,article,https://static01.nyt.com/images/2017/04/21/world/21int-signals-1/21int-signals-1-facebookJumbo.jpg,,,,,,,,,,,,
95,instapaper,,"Computational thinking — approaching problems the way a programmer would — is captivating educators, from kindergarten teachers to college professors.",Learning to Think Like a Computer,https://www.nytimes.com/2017/04/04/education/edlife/teaching-students-computer-code.html,,,,https://www.nytimes.com/2017/04/04/education/edlife/teaching-students-computer-code.html,2017-04-04 16:46:53.000000,article,https://static01.nyt.com/images/2017/04/09/education/09COMPUTE1/09COMPUTE1-facebookJumbo.jpg,,,,,,,,,,,,
96,instapaper,Quartz,The world is accustomed to attention-seeking military stunts from the North. It's just that they're getting harder to dismiss.,"Nasty, brutish, and short—what the next Korean War will look like",https://qz.com/950488/nasty-brutish-and-short-what-the-next-korean-war-will-look-like/,,,,https://qz.com/950488/nasty-brutish-and-short-what-the-next-korean-war-will-look-like/,2017-04-15 18:06:55.000000,article,https://qzprod.files.wordpress.com/2017/04/rts11w2m-e1491497729323.jpg?quality=80&strip=all&w=1600,en_US,900,1600,,,,,,,,,
97,instapaper,NPR.org,"When he invented the Web 28 years ago, Tim Berners-Lee saw it as a way to break apart silos and connect the world. Now he's increasingly troubled about its dark side, but he believes it can be fixed.",The Father Of The Web Is Worried About How Ugly It's Become,https://www.npr.org/sections/alltechconsidered/2017/04/04/522593360/the-father-of-the-web-is-worried-about-how-ugly-its-become,,,,http://www.npr.org/sections/alltechconsidered/2017/04/04/522593360/the-father-of-the-web-is-worried-about-how-ugly-its-become,2017-04-05 21:49:37.000000,article,https://media.npr.org/assets/img/2017/04/04/gettyimages-143034371-1-_wide-aa4549c59af1a938aa95ef6b2e50d351ecc39049.jpg?s=1400,,,,,,,,,,,,
98,instapaper,Poynter,,Inside the 8-month reinvention of an unprofitable college newspaper,https://www.poynter.org/news/inside-8-month-reinvention-unprofitable-college-newspaper,,,,http://www.poynter.org/2017/inside-the-8-month-reinvention-of-an-unprofitable-college-newspaper/454455/,2017-04-04 20:02:36.000000,,https://www.poynter.org/sites/default/files/wp-content/uploads/2017/04/The_Daily_Tar_Heel_office.jpg,,,,,,,,image/jpeg,,,,
99,instapaper,,People who have depended on programs that would be hurt by the president’s cost-cutting say they stand by him.,"Opinion | In Trump Country, Shock at Trump Budget Cuts, but Still Loyalty",https://www.nytimes.com/2017/04/01/opinion/sunday/in-trump-country-shock-at-trump-budget-cuts-but-still-loyalty.html,,,,https://www.nytimes.com/2017/04/01/opinion/sunday/in-trump-country-shock-at-trump-budget-cuts-but-still-loyalty.html?nytmobile=0,2017-04-02 13:32:59.000000,article,https://static01.nyt.com/images/2017/04/02/opinion/sunday/02kristof/02kristof-facebookJumbo.jpg,,,,,,,,,,,,
100,instapaper,The Atlantic,New research on the creatures’ family tree could “shake dinosaur paleontology to its core.”,A 130-Year-Old Fact About Dinosaurs Might Be Wrong,https://www.theatlantic.com/science/archive/2017/03/dinosaur-family-tree-saurischia-ornithischia-childhood-shattered-what-is-real-anymore/520338/,,,,https://www.theatlantic.com/science/archive/2017/03/dinosaur-family-tree-saurischia-ornithischia-childhood-shattered-what-is-real-anymore/520338/,2017-03-22 23:09:26.000000,article,https://cdn.theatlantic.com/assets/media/img/mt/2017/03/RTR4WSR1/facebook.jpg?1490194214,en_US,,,,,,,,,,,
101,instapaper,,"Widespread memes used against African-Americans say America was built by Irish slaves whose history has been covered up. That’s false, historians say.","Debunking a Myth: The Irish Were Not Slaves, Too",https://www.nytimes.com/2017/03/17/us/irish-slaves-myth.html,,,,https://www.nytimes.com/2017/03/17/us/irish-slaves-myth.html,2017-03-20 19:09:22.000000,article,https://static01.nyt.com/images/2017/03/17/us/17irish2a_xp/17irish2_xp-facebookJumbo-v3.jpg,,,,,,,,,,,,
102,instapaper,,"The new studies come at an interesting moment, with a proponent of vouchers newly in charge of the Education Department.",Dismal Voucher Results Surprise Researchers as DeVos Era Begins,https://www.nytimes.com/2017/02/23/upshot/dismal-results-from-vouchers-surprise-researchers-as-devos-era-begins.html,,,,https://www.nytimes.com/2017/02/23/upshot/dismal-results-from-vouchers-surprise-researchers-as-devos-era-begins.html,2017-02-27 19:46:38.000000,article,https://static01.nyt.com/images/2017/02/22/upshot/23up-vouchers/23up-vouchers-facebookJumbo.jpg,,,,,,,,,,,,
103,instapaper,the Guardian,"The long read: She is venerated around the world. She has outlasted 12 US presidents. She stands for stability and order. But her kingdom is in turmoil, and her subjects are in denial that her reign will ever end. That’s why the palace has a plan.",'London Bridge is down': the secret plan for the days after the Queen’s death,http://www.theguardian.com/uk-news/2017/mar/16/what-happens-when-queen-elizabeth-dies-london-bridge,,,,http://www.theguardian.com/uk-news/2017/mar/16/what-happens-when-queen-elizabeth-dies-london-bridge,2017-03-19 22:59:30.000000,article,https://i.guim.co.uk/img/media/9953cf740343550403836d6f3230eafcabaca47c/151_0_2193_1316/master/2193.jpg?w=1200&h=630&q=55&auto=format&usm=12&fit=crop&crop=faces%2Centropy&bm=normal&ba=bottom%2Cleft&blend64=aHR0cHM6Ly91cGxvYWRzLmd1aW0uY28udWsvMjAxNi8wNS8yNS9vdmVybGF5LWxvZ28tMTIwMC05MF9vcHQucG5n&s=def78aa846150e6da507f75545220e2d,,720,1200,,,,,,,,,
104,instapaper,Washington Post,"""Grump” appears in three episodes spanning decades — sowing fear and chaos and inspiring a political march down Sesame Street.",Trump wants to defund PBS. ‘Sesame Street’ brutally parodied him for decades.,https://www.washingtonpost.com/news/arts-and-entertainment/wp/2017/03/20/trump-wants-to-defund-pbs-sesame-street-brutally-parodied-him-for-decades/,,,,https://www.washingtonpost.com/news/arts-and-entertainment/wp/2017/03/20/trump-wants-to-defund-pbs-sesame-street-brutally-parodied-him-for-decades/,2017-03-20 20:59:51.000000,article,https://www.washingtonpost.com/pbox.php?url=http://www.washingtonpost.com/blogs/style-blog/files/2017/03/Screen-Shot-2017-03-20-at-8.44.19-AM.jpg&w=1484&op=resize&opt=1&filter=antialias&t=20170517,,,,,,,,,,,,
105,instapaper,The New Yorker,"At a headline pitch meeting, the writers of the satirical newspaper try to stay away from low-hanging fruit.",The Onion Struggles to Lampoon Trump,https://www.newyorker.com/magazine/2017/03/20/the-onion-struggles-to-lampoon-trump,,,,http://www.newyorker.com/magazine/2017/03/20/the-onion-struggles-to-lampoon-trump,2017-03-14 23:45:44.000000,article,"https://media.newyorker.com/photos/59097f1bc14b3c606c109b94/16:9/w_1200,h_630,c_limit/170320_r29594web.jpg",en_US,,,,,,,,,,,
106,instapaper,Foreign Policy,North Korea isn’t testing its missiles. It’s preparing for a nuclear first strike.,North Korea Is Practicing for Nuclear War,https://foreignpolicy.com/2017/03/09/north-korea-is-practicing-for-nuclear-war/,,,,https://foreignpolicy.com/2017/03/09/north-korea-is-practicing-for-nuclear-war/,2017-03-12 23:19:48.000000,article,https://foreignpolicymag.files.wordpress.com/2017/03/gettyimages-649080078.jpg,,,,,,,,,,,,
107,instapaper,,A bipartisan obsession with Islamist terrorism has distorted America’s understanding of its interests and poisoned our politics.,Opinion | How Our Strategy Against Terrorism Gave Us Trump,https://www.nytimes.com/2017/03/04/opinion/sunday/how-our-strategy-against-terrorism-gave-us-trump.html,,,,https://www.nytimes.com/2017/03/04/opinion/sunday/how-our-strategy-against-terrorism-gave-us-trump.html,2017-03-07 21:16:03.000000,article,https://static01.nyt.com/images/2017/03/05/opinion/sunday/05finer/05finer-facebookJumbo-v2.jpg,,,,,,,,,,,,
108,instapaper,BuzzFeed,"A liberal and a conservative published almost exactly the same article, and BuzzFeed News traced them back to the same owners.",This Is How Your Hyperpartisan Political News Gets Made,https://www.buzzfeed.com/craigsilverman/how-the-hyperpartisan-sausage-is-made,,,,https://www.buzzfeed.com/craigsilverman/how-the-hyperpartisan-sausage-is-made,2017-03-02 03:05:37.000000,article,"https://img.buzzfeed.com/buzzfeed-static/static/2017-02/27/17/enhanced/buzzfeed-prod-fastlane-03/original-8129-1488233702-11.jpg?crop=990:518;0,53",,,,,,,,,,,,
109,instapaper,AP News,"
              WASHINGTON (AP) — At a circular booth in the middle of the Trump International Hotel's balcony restaurant, President Donald Trump dined on his steak — well-done, with ketchu",Trump hotel may be political capital of the nation's capital,https://apnews.com/cc2e2c2b6b4d4417afff3aa5f768be10,,,,https://apnews.com/cc2e2c2b6b4d4417afff3aa5f768be10,2017-03-06 02:48:24.000000,article,https://storage.googleapis.com/afs-prod/media/media:9a92c51b8e0b412eb13d231dd6891da7/800.jpeg,en_US,600,800,,,,,,,,,
110,instapaper,The Atlantic,Anxiety and listless days as a foreign-policy bureaucracy confronts the possibility of radical change,'They Really Want to Blow This Place Up': Scenes From Trump's State Department,https://www.theatlantic.com/international/archive/2017/03/state-department-trump/517965/,,,,https://www.theatlantic.com/international/archive/2017/03/state-department-trump/517965/,2017-03-02 01:11:31.000000,article,https://cdn.theatlantic.com/assets/media/img/mt/2017/02/GettyImages_632781806/facebook.jpg?1488225747,en_US,,,,,,,,,,,
111,instapaper,,Obama administration officials scrambled to ensure intelligence of connections between the Trump campaign and Russian officials was preserved after they left office.,Obama Administration Rushed to Preserve Intelligence of Russian Election Hacking,https://www.nytimes.com/2017/03/01/us/politics/obama-trump-russia-election-hacking.html,,,,https://www.nytimes.com/2017/03/01/us/politics/obama-trump-russia-election-hacking.html?nytmobile=0,2017-03-02 01:35:27.000000,article,https://static01.nyt.com/images/2017/03/02/us/02intel1/02intel1-facebookJumbo.jpg,,,,,,,,,,,,
112,instapaper,Vice,ICE officials claim that the immigration program Daniela Vargas's parents used to come into the country doesn't grant its participants the right to a hearing.,DREAMer Who Got Arrested After Speaking Out to Be Deported Without Hearing,https://www.vice.com/en_us/article/4xpvpp/dreamer-who-got-arrested-after-speaking-out-to-be-deported-without-hearing-vgtrn,,,,https://www.vice.com/en_us/article/dreamer-who-got-arrested-after-speaking-out-to-be-deported-without-hearing-vgtrn,2017-03-04 16:26:06.000000,article,"https://video-images.vice.com/articles/58b9a1f8e183e12c00b6164c/lede/1488562308736-AP_17060697479574.jpeg?crop=0.7735xw:0.7726xh;0.1105xw,0xh&resize=1200:*",en_us,675,1200,,,,,image/jpeg,,,,
